{
  "claim_id": "GK_01",
  "home_regime": {
    "framework": "SARI spectral theory",
    "regime_keywords": [
      "sari",
      "alfven",
      "ma"
    ],
    "system": "rotating plasma"
  },
  "label": "Super-Alfvenic Rotational Instability emerges from overlap of Doppler-shifted Alfven continua",
  "paper_id": "goedbloed2022",
  "predictions": [
    {
      "evidence_ids": [
        "ev_goedbloed_sari"
      ],
      "observable": "ev_goedbloed_sari",
      "regime_tag": "in_regime",
      "scale": "normalized_binary",
      "value": 0.0
    }
  ],
  "provenance": {
    "confidence": 0.66,
    "extractor": "deterministic_seed",
    "review_status": "unreviewed",
    "source_span": "The Astrophysical Journal Supplement Series, 259:65 (41pp), 2022 April https://doi.org/10.3847/1538-4365/ac573c \u00a9 2022. The Author(s). Published by the American Astronomical Society. The Super-Alfv\u00e9nic Rotational Instability in Accretion Disks about Black Holes"
  },
  "rewrite_history": [],
  "stalk_basis": [
    "in_regime_strength",
    "out_regime_strength"
  ],
  "strengths": [
    "Explains the SARI mechanism through continuum overlap."
  ],
  "weaknesses": [
    "It describes the super-Alfvenic instability mechanism, not the sub-Alfvenic exclusion side by itself."
  ],
  "x_final": [
    1.0,
    1.0
  ],
  "x_init": [
    1.0,
    1.0
  ]
}
